{
  "schema_version": "0.1.0",
  "session_id": "session_demo_001",
  "lesson_id": "lesson_market_001",
  "state": "SPEAKING",
  "progress": 0.4,
  "completed_turns": 1,
  "turns": [
    {
      "schema_version": "0.1.0",
      "turn_id": "turn_001",
      "session_id": "session_demo_001",
      "transcript_raw": "市場",
      "transcript_normalized": "市場",
      "result": "correct",
      "matched_concepts": ["市場"],
      "feedback": "答對了。",
      "next_prompt": "請說：阿媽欲去市場。",
      "progress": 0.4,
      "latency_ms": { "asr": 820, "backend": 95, "vlm": null, "tts": 310, "total": 1225 },
      "asr_device": "cpu",
      "fallbacks": ["asr_cpu"]
    }
  ],
  "concepts_to_review": ["欲去"],
  "hint_history": [],
  "familiarity": [
    { "concept": "市場", "status": "developing" },
    { "concept": "欲去", "status": "new" }
  ]
}
